{
  "sessionId": "sess_signer-07_student_rep4",
  "signerId": "signer-07",
  "signId": "student",
  "signLabel": "STUDENT",
  "type": "dynamic",
  "sampleRateFps": 30,
  "frames": [
    {
      "frameIndex": 0,
      "timestampMs": 0.0,
      "handsCount": 1,
      "leftHand": [],
      "rightHand": [
        {
          "x": 0.5350502124919252,
          "y": 0.6343117696842072,
          "z": 0.0
        },
        {
          "x": 0.4990502124919252,
          "y": 0.5983117696842072,
          "z": -0.009
        },
        {
          "x": 0.4720502124919252,
          "y": 0.5623117696842073,
          "z": -0.018
        },
        {
          "x": 0.4540502124919252,
          "y": 0.5263117696842072,
          "z": -0.027
        },
        {
          "x": 0.4360502124919252,
          "y": 0.4993117696842072,
          "z": -0.036
        },
        {
          "x": 0.4900502124919252,
          "y": 0.5263117696842072,
          "z": 0.0
        },
        {
          "x": 0.4900502124919252,
          "y": 0.49481176968420726,
          "z": 0.009
        },
        {
          "x": 0.4900502124919252,
          "y": 0.46331176968420723,
          "z": 0.018
        },
        {
          "x": 0.4900502124919252,
          "y": 0.43631176968420726,
          "z": 0.027
        },
        {
          "x": 0.5350502124919252,
          "y": 0.5173117696842072,
          "z": 0.0
        },
        {
          "x": 0.5350502124919252,
          "y": 0.48581176968420725,
          "z": 0.009
        },
        {
          "x": 0.5350502124919252,
          "y": 0.4543117696842072,
          "z": 0.018
        },
        {
          "x": 0.5350502124919252,
          "y": 0.42731176968420725,
          "z": 0.027
        },
        {
          "x": 0.5800502124919252,
          "y": 0.5263117696842072,
          "z": 0.0
        },
        {
          "x": 0.5800502124919252,
          "y": 0.49481176968420726,
          "z": 0.009
        },
        {
          "x": 0.5800502124919252,
          "y": 0.46331176968420723,
          "z": 0.018
        },
        {
          "x": 0.5800502124919252,
          "y": 0.43631176968420726,
          "z": 0.027
        },
        {
          "x": 0.6160502124919252,
          "y": 0.5443117696842072,
          "z": 0.0
        },
        {
          "x": 0.6160502124919252,
          "y": 0.5128117696842073,
          "z": 0.009
        },
        {
          "x": 0.6160502124919252,
          "y": 0.48131176968420725,
          "z": 0.018
        },
        {
          "x": 0.6160502124919252,
          "y": 0.4543117696842073,
          "z": 0.027
        }
      ]
    },
    {
      "frameIndex": 1,
      "timestampMs": 33.33,
      "handsCount": 1,
      "leftHand": [],
      "rightHand": [
        {
          "x": 0.5416537173540847,
          "y": 0.6193143102586348,
          "z": 0.0
        },
        {
          "x": 0.5056537173540847,
          "y": 0.5833143102586348,
          "z": -0.009
        },
        {
          "x": 0.47865371735408474,
          "y": 0.5473143102586349,
          "z": -0.018
        },
        {
          "x": 0.4606537173540847,
          "y": 0.5113143102586348,
          "z": -0.027
        },
        {
          "x": 0.44265371735408476,
          "y": 0.4843143102586348,
          "z": -0.036
        },
        {
          "x": 0.49665371735408476,
          "y": 0.5113143102586348,
          "z": 0.0
        },
        {
          "x": 0.49665371735408476,
          "y": 0.47981431025863486,
          "z": 0.009
        },
        {
          "x": 0.49665371735408476,
          "y": 0.44831431025863483,
          "z": 0.018
        },
        {
          "x": 0.49665371735408476,
          "y": 0.42131431025863486,
          "z": 0.027
        },
        {
          "x": 0.5416537173540847,
          "y": 0.5023143102586348,
          "z": 0.0
        },
        {
          "x": 0.5416537173540847,
          "y": 0.47081431025863485,
          "z": 0.009
        },
        {
          "x": 0.5416537173540847,
          "y": 0.4393143102586348,
          "z": 0.018
        },
        {
          "x": 0.5416537173540847,
          "y": 0.41231431025863485,
          "z": 0.027
        },
        {
          "x": 0.5866537173540848,
          "y": 0.5113143102586348,
          "z": 0.0
        },
        {
          "x": 0.5866537173540848,
          "y": 0.47981431025863486,
          "z": 0.009
        },
        {
          "x": 0.5866537173540848,
          "y": 0.44831431025863483,
          "z": 0.018
        },
        {
          "x": 0.5866537173540848,
          "y": 0.42131431025863486,
          "z": 0.027
        },
        {
          "x": 0.6226537173540847,
          "y": 0.5293143102586348,
          "z": 0.0
        },
        {
          "x": 0.6226537173540847,
          "y": 0.4978143102586349,
          "z": 0.009
        },
        {
          "x": 0.6226537173540847,
          "y": 0.46631431025863485,
          "z": 0.018
        },
        {
          "x": 0.6226537173540847,
          "y": 0.4393143102586349,
          "z": 0.027
        }
      ]
    },
    {
      "frameIndex": 2,
      "timestampMs": 66.66,
      "handsCount": 1,
      "leftHand": [],
      "rightHand": [
        {
          "x": 0.5315650078336817,
          "y": 0.62002738507022,
          "z": 0.0
        },
        {
          "x": 0.4955650078336817,
          "y": 0.58402738507022,
          "z": -0.009
        },
        {
          "x": 0.46856500783368166,
          "y": 0.5480273850702201,
          "z": -0.018
        },
        {
          "x": 0.45056500783368164,
          "y": 0.51202738507022,
          "z": -0.027
        },
        {
          "x": 0.4325650078336817,
          "y": 0.48502738507022003,
          "z": -0.036
        },
        {
          "x": 0.4865650078336817,
          "y": 0.51202738507022,
          "z": 0.0
        },
        {
          "x": 0.4865650078336817,
          "y": 0.4805273850702201,
          "z": 0.009
        },
        {
          "x": 0.4865650078336817,
          "y": 0.44902738507022005,
          "z": 0.018
        },
        {
          "x": 0.4865650078336817,
          "y": 0.4220273850702201,
          "z": 0.027
        },
        {
          "x": 0.5315650078336817,
          "y": 0.50302738507022,
          "z": 0.0
        },
        {
          "x": 0.5315650078336817,
          "y": 0.4715273850702201,
          "z": 0.009
        },
        {
          "x": 0.5315650078336817,
          "y": 0.44002738507022005,
          "z": 0.018
        },
        {
          "x": 0.5315650078336817,
          "y": 0.4130273850702201,
          "z": 0.027
        },
        {
          "x": 0.5765650078336817,
          "y": 0.51202738507022,
          "z": 0.0
        },
        {
          "x": 0.5765650078336817,
          "y": 0.4805273850702201,
          "z": 0.009
        },
        {
          "x": 0.5765650078336817,
          "y": 0.44902738507022005,
          "z": 0.018
        },
        {
          "x": 0.5765650078336817,
          "y": 0.4220273850702201,
          "z": 0.027
        },
        {
          "x": 0.6125650078336816,
          "y": 0.5300273850702201,
          "z": 0.0
        },
        {
          "x": 0.6125650078336816,
          "y": 0.4985273850702201,
          "z": 0.009
        },
        {
          "x": 0.6125650078336816,
          "y": 0.46702738507022007,
          "z": 0.018
        },
        {
          "x": 0.6125650078336816,
          "y": 0.4400273850702201,
          "z": 0.027
        }
      ]
    },
    {
      "frameIndex": 3,
      "timestampMs": 99.99,
      "handsCount": 1,
      "leftHand": [],
      "rightHand": [
        {
          "x": 0.5277806274296521,
          "y": 0.6142742331608798,
          "z": 0.0
        },
        {
          "x": 0.4917806274296522,
          "y": 0.5782742331608798,
          "z": -0.009
        },
        {
          "x": 0.46478062742965215,
          "y": 0.5422742331608799,
          "z": -0.018
        },
        {
          "x": 0.44678062742965213,
          "y": 0.5062742331608798,
          "z": -0.027
        },
        {
          "x": 0.4287806274296522,
          "y": 0.4792742331608798,
          "z": -0.036
        },
        {
          "x": 0.48278062742965216,
          "y": 0.5062742331608798,
          "z": 0.0
        },
        {
          "x": 0.48278062742965216,
          "y": 0.47477423316087985,
          "z": 0.009
        },
        {
          "x": 0.48278062742965216,
          "y": 0.4432742331608798,
          "z": 0.018
        },
        {
          "x": 0.48278062742965216,
          "y": 0.41627423316087986,
          "z": 0.027
        },
        {
          "x": 0.5277806274296521,
          "y": 0.4972742331608798,
          "z": 0.0
        },
        {
          "x": 0.5277806274296521,
          "y": 0.46577423316087985,
          "z": 0.009
        },
        {
          "x": 0.5277806274296521,
          "y": 0.4342742331608798,
          "z": 0.018
        },
        {
          "x": 0.5277806274296521,
          "y": 0.40727423316087985,
          "z": 0.027
        },
        {
          "x": 0.5727806274296522,
          "y": 0.5062742331608798,
          "z": 0.0
        },
        {
          "x": 0.5727806274296522,
          "y": 0.47477423316087985,
          "z": 0.009
        },
        {
          "x": 0.5727806274296522,
          "y": 0.4432742331608798,
          "z": 0.018
        },
        {
          "x": 0.5727806274296522,
          "y": 0.41627423316087986,
          "z": 0.027
        },
        {
          "x": 0.6087806274296521,
          "y": 0.5242742331608798,
          "z": 0.0
        },
        {
          "x": 0.6087806274296521,
          "y": 0.49277423316087987,
          "z": 0.009
        },
        {
          "x": 0.6087806274296521,
          "y": 0.46127423316087984,